{
  "benchmark_id": "fiction-role-benchmark-v1",
  "pack_version": "1.0.0",
  "role": "continuity",
  "attempt_id": "wave0-gpt56-luna-continuity-a1",
  "requested_route": {
    "provider": "openai-codex",
    "model": "gpt-5.6-luna",
    "profile": "gpt56-luna",
    "evidence_path": "route-evidence.log"
  },
  "served_route": {
    "provider": "openai-codex",
    "model": "gpt-5.6-luna",
    "profile": "gpt56-luna",
    "evidence_path": "route-evidence.log"
  },
  "routing_status": "verified_exact",
  "usage_class": "low",
  "entitlement_or_cost_gate": "ordinary ChatGPT Pro Codex allowance; no extra-credit spend",
  "packet_manifest_sha256": "bd30312a7fa23ff226cbe06c32992d7b7de982c2a1741e4cfe7543f95777e282",
  "started_at": "2026-08-09T22:02:15.356941+00:00",
  "ended_at": "2026-08-09T22:02:55.778559+00:00",
  "latency_ms": 39885,
  "settings": {
    "temperature": null,
    "reasoning": "medium",
    "max_output_tokens": 4096,
    "tool_access": "profile tools unintentionally available",
    "fresh_session": true
  },
  "status": "invalid",
  "failures": [
    {
      "class": "instruction",
      "message": "Attempt invalidated: empty --toolsets override was ignored; tool access remained available (tool_turns=1). Retried with --toolsets none.",
      "retryable": false
    }
  ],
  "artifacts": [
    {
      "path": "prompt.txt",
      "sha256": "e8da425032ceaa26a3ead852283b0e88b9afaab35f669960f4fcd617fda6df4a"
    },
    {
      "path": "raw-stdout.txt",
      "sha256": "6a3ae5af640f6cf7e9f9622b91d21c20d5438d2ffd1fbae8aea1ec72266d1abd"
    },
    {
      "path": "raw-stderr.txt",
      "sha256": "454e2bae169cfbbc91491d2dfc2ed9577d15a252a37e802c3b6d485a20e4d818"
    },
    {
      "path": "route-evidence.log",
      "sha256": "9627ab45a5f65273466844e878885acb5f1c63935f4d25380954516bfdca9c4f"
    },
    {
      "path": "submission.json",
      "sha256": "6a3ae5af640f6cf7e9f9622b91d21c20d5438d2ffd1fbae8aea1ec72266d1abd"
    },
    {
      "path": "validation-result.json",
      "sha256": "a50a737850032428e2a3a9021577e75229bdf91d148bed5fa5ace8f6974bbd81"
    }
  ],
  "usage": {
    "input_tokens": 12224,
    "output_tokens": 121,
    "cached_tokens": null,
    "provider_reported_cost": null
  },
  "notes": "Fresh isolated Hermes session 20260810_080215_ce2e45; raw stdout preserved unchanged. Attempt 1.",
  "score": null
}
