{
  "benchmark_id": "fiction-role-benchmark-v1",
  "pack_version": "1.0.0",
  "role": "researcher",
  "attempt_id": "wave0-gpt56-luna-researcher-a1",
  "requested_route": {
    "provider": "openai-codex",
    "model": "gpt-5.6-luna",
    "profile": "gpt56-luna",
    "evidence_path": "route-evidence.log"
  },
  "served_route": {
    "provider": "openai-codex",
    "model": "gpt-5.6-luna",
    "profile": "gpt56-luna",
    "evidence_path": "route-evidence.log"
  },
  "routing_status": "verified_exact",
  "usage_class": "low",
  "entitlement_or_cost_gate": "ordinary ChatGPT Pro Codex allowance; no extra-credit spend",
  "packet_manifest_sha256": "bd30312a7fa23ff226cbe06c32992d7b7de982c2a1741e4cfe7543f95777e282",
  "started_at": "2026-08-09T22:01:49.507731+00:00",
  "ended_at": "2026-08-09T22:02:15.355425+00:00",
  "latency_ms": 25290,
  "settings": {
    "temperature": null,
    "reasoning": "medium",
    "max_output_tokens": 4096,
    "tool_access": "profile tools unintentionally available",
    "fresh_session": true
  },
  "status": "invalid",
  "failures": [
    {
      "class": "instruction",
      "message": "Attempt invalidated: empty --toolsets override was ignored; tool access remained available (tool_turns=1). Retried with --toolsets none.",
      "retryable": false
    }
  ],
  "artifacts": [
    {
      "path": "prompt.txt",
      "sha256": "379cab9dfa768f300c80c61d4725f20bbdf8a8332badb2e2db617607694115c1"
    },
    {
      "path": "raw-stdout.txt",
      "sha256": "b225ecb0b0e956e648c05212cc922227a0bfcaa123569eb6cc415c11960f8453"
    },
    {
      "path": "raw-stderr.txt",
      "sha256": "9a4c3bf5f205903e608db788397c174d5fc4922c773e92ba6ce0f912f1e9458d"
    },
    {
      "path": "route-evidence.log",
      "sha256": "6b76c5b258be8b16604ee1d857f66f99d5cac3edc98a513a1753b3363f65fd66"
    },
    {
      "path": "submission.json",
      "sha256": "b225ecb0b0e956e648c05212cc922227a0bfcaa123569eb6cc415c11960f8453"
    },
    {
      "path": "validation-result.json",
      "sha256": "9bfa1dc168fbfa56f5c4c915b0d1b60c152789900202deb2e5fb4880a06ff561"
    }
  ],
  "usage": {
    "input_tokens": 12471,
    "output_tokens": 134,
    "cached_tokens": 11776,
    "provider_reported_cost": null
  },
  "notes": "Fresh isolated Hermes session 20260810_080149_92f404; raw stdout preserved unchanged. Attempt 1.",
  "score": null
}
