{
  "benchmark_id": "fiction-role-benchmark-v1",
  "pack_version": "1.0.0",
  "role": "reader",
  "attempt_id": "wave0-gpt56-luna-reader-a2",
  "requested_route": {
    "provider": "openai-codex",
    "model": "gpt-5.6-luna",
    "profile": "gpt56-luna",
    "evidence_path": "route-evidence.log"
  },
  "served_route": {
    "provider": "openai-codex",
    "model": "gpt-5.6-luna",
    "profile": "gpt56-luna",
    "evidence_path": "route-evidence.log"
  },
  "routing_status": "verified_exact",
  "usage_class": "low",
  "entitlement_or_cost_gate": "ordinary ChatGPT Pro Codex allowance; no extra-credit spend",
  "packet_manifest_sha256": "bd30312a7fa23ff226cbe06c32992d7b7de982c2a1741e4cfe7543f95777e282",
  "started_at": "2026-08-09T22:05:25.929552+00:00",
  "ended_at": "2026-08-09T22:05:46.147837+00:00",
  "latency_ms": 19680,
  "settings": {
    "temperature": null,
    "reasoning": "medium",
    "max_output_tokens": 4096,
    "tool_access": "none",
    "fresh_session": true
  },
  "status": "fail",
  "failures": [
    {
      "class": "schema",
      "message": "Output failed strict JSON Schema validation; see validation-result.json.",
      "retryable": false
    },
    {
      "class": "instruction",
      "message": "invalid desire_to_continue",
      "retryable": false
    }
  ],
  "artifacts": [
    {
      "path": "prompt.txt",
      "sha256": "4fefb7696b2b3195919a4b09f02360dae4a7aa9b1364a2a87089d65b257cacb4"
    },
    {
      "path": "raw-stdout.txt",
      "sha256": "4ab9b31e6cd352eae2d6e5fb66bccbc40026017d25633bd0b2d9e96e857b32d3"
    },
    {
      "path": "raw-stderr.txt",
      "sha256": "5b06fdd464289b2a455d6bcc25a94a8c2c8dfc2d3b2ce0d645454cd82426ac69"
    },
    {
      "path": "route-evidence.log",
      "sha256": "dc8135dd99c816db6a7b347c515858c3f0361ba36c5e98ca4ff074d7dbfd2704"
    },
    {
      "path": "submission.json",
      "sha256": "2f6072cac7d0d669b23b0322c454ae171d8da8368d42537077b168173442df67"
    },
    {
      "path": "validation-result.json",
      "sha256": "d190600985fa7a583fac02195fb3724d1357ea2944fc6045a0d3035673554ba7"
    }
  ],
  "usage": {
    "input_tokens": 1604,
    "output_tokens": 857,
    "cached_tokens": null,
    "provider_reported_cost": null
  },
  "notes": "Fresh isolated Hermes session 20260810_080526_7aa616; raw stdout preserved unchanged. Attempt 2. Known CLI warning prefix was preserved in raw stdout and removed from submission extraction. Blind human score locked before deterministic adjudication; run remains ineligible due hard-gate failure.",
  "score": {
    "human_total": 94,
    "deterministic_penalty": 0,
    "final_score": 94,
    "scorer_count": 1,
    "score_record_paths": [
      "evidence/wave0-gpt56-luna-20260810/blind-scoring/adjudicated/CANDIDATE-002.score.json"
    ]
  }
}
