{
  "benchmark_id": "fiction-role-benchmark-v1",
  "pack_version": "1.0.0",
  "role": "writer",
  "attempt_id": "wave0-gpt56-luna-writer-a2",
  "requested_route": {
    "provider": "openai-codex",
    "model": "gpt-5.6-luna",
    "profile": "gpt56-luna",
    "evidence_path": "route-evidence.log"
  },
  "served_route": {
    "provider": "openai-codex",
    "model": "gpt-5.6-luna",
    "profile": "gpt56-luna",
    "evidence_path": "route-evidence.log"
  },
  "routing_status": "verified_exact",
  "usage_class": "low",
  "entitlement_or_cost_gate": "ordinary ChatGPT Pro Codex allowance; no extra-credit spend",
  "packet_manifest_sha256": "bd30312a7fa23ff226cbe06c32992d7b7de982c2a1741e4cfe7543f95777e282",
  "started_at": "2026-08-09T22:06:47.097341+00:00",
  "ended_at": "2026-08-09T22:07:30.738674+00:00",
  "latency_ms": 42316,
  "settings": {
    "temperature": null,
    "reasoning": "medium",
    "max_output_tokens": 4096,
    "tool_access": "none",
    "fresh_session": true
  },
  "status": "fail",
  "failures": [
    {
      "class": "instruction",
      "message": "word count 1561 outside 900-1200",
      "retryable": false
    },
    {
      "class": "instruction",
      "message": "required beat markers out of order",
      "retryable": false
    }
  ],
  "artifacts": [
    {
      "path": "prompt.txt",
      "sha256": "565858c527c0e86effd773334c1f92d4abd65f6ce3bcae4e8ee0963024c5734a"
    },
    {
      "path": "raw-stdout.txt",
      "sha256": "e8493c5fab1eb7cbb08cda590ee09fa00d8fb558475e0ca8a1794b23e44e5241"
    },
    {
      "path": "raw-stderr.txt",
      "sha256": "736d095949ec973c3c9ccee3458e1c4397550744dd7b6d6c2e1ec19156960a0f"
    },
    {
      "path": "route-evidence.log",
      "sha256": "29293d25379dd37b65d88cb00699f0d7c54dbdac81b76e9e7b9ea4953c7cc603"
    },
    {
      "path": "submission.md",
      "sha256": "eba6af594d5a5fc7afc25c49343415a693a989bfe6dac938c1e3fdb33f9ced6a"
    },
    {
      "path": "validation-result.json",
      "sha256": "fb9cadad12927bef890cffbf0ea3180efe0d01de7f9751a918023dbba691951c"
    }
  ],
  "usage": {
    "input_tokens": 1496,
    "output_tokens": 2119,
    "cached_tokens": null,
    "provider_reported_cost": null
  },
  "notes": "Fresh isolated Hermes session 20260810_080647_a4be3d; raw stdout preserved unchanged. Attempt 2. Known CLI warning prefix was preserved in raw stdout and removed from submission extraction.",
  "score": null
}
